{
  "manifest_id": "external-standard-v1",
  "profile": "standard",
  "version": "1.0",
  "status": "current",
  "authority": "supporting_evidence",
  "last_verified": "2026-05-01",
  "gate_count": 3,
  "gates": [
    {
      "gate_id": "ruff_check",
      "display_name": "ruff check",
      "layer": "L0",
      "hardness": "hard",
      "command": "ruff check .",
      "expected_result_type": "exit_code_0",
      "purpose": "Static analysis",
      "protects_against": "code quality regression"
    },
    {
      "gate_id": "ruff_format",
      "display_name": "ruff format",
      "layer": "L0",
      "hardness": "hard",
      "command": "ruff format --check .",
      "expected_result_type": "exit_code_0",
      "purpose": "Code formatting consistency",
      "protects_against": "formatting drift"
    },
    {
      "gate_id": "pytest",
      "display_name": "pytest suite",
      "layer": "L0",
      "hardness": "hard",
      "command": "pytest tests/ -q",
      "expected_result_type": "exit_code_0",
      "purpose": "Test suite validation",
      "protects_against": "test regression"
    }
  ]
}
